id,example_ja,example_zh
n3_0573,出かける前にドアをロックしてください。,出門前請把門鎖上。
n3_0574,冬は暖房をつけて部屋を暖めます。,冬天會開暖氣讓房間變暖。
n3_0575,クリスマスの飾りを窓に付けました。,我把聖誕裝飾掛在窗邊。
n3_0576,キッチンで夕食を作っています。,正在廚房做晚餐。
n3_0577,寝室の電気を消して寝ました。,關掉寢室的燈後睡覺了。
n3_0578,洗面所で顔を洗いました。,我在洗手台洗了臉。
n3_0579,家族はダイニングで朝食を食べます。,家人在餐廳吃早餐。
n3_0580,排水口が詰まって水が流れません。,排水口塞住，水流不下去。
n3_0581,天井に新しい照明を付けました。,我在天花板裝了新的照明。
n3_0582,古い家の柱はとても太いです。,老房子的柱子很粗。
n3_0583,日差しが強いのでブラインドを下ろしました。,陽光太強，所以放下百葉窗。
n3_0584,引っ越す前に部屋の間取りを確認しました。,搬家前確認了房間格局。
n3_0585,寒い夜は毛布を一枚多く使います。,寒冷的夜晚會多用一條毛毯。
n3_0586,床に荷物を置かないでください。,請不要把行李放在地板上。
n3_0587,音が大きすぎるので少し弱めました。,聲音太大，所以我稍微調小了。
n3_0588,家族はリビングでテレビを見ています。,家人正在客廳看電視。
n3_0589,肉の脂を少し取ってから焼きます。,先去掉一點肉的油脂再烤。
n3_0590,この薬は食後に飲んでください。,這個藥請飯後服用。
n3_0591,食前に手を洗いましょう。,飯前洗手吧。
n3_0592,このみかんは少し酸っぱいです。,這顆橘子有點酸。
n3_0593,食事のマナーを守りましょう。,遵守用餐禮儀吧。
n3_0594,レストランでメニューを見ています。,正在餐廳看菜單。
n3_0595,今日は友達とランチに行きます。,今天要和朋友去吃午餐。
n3_0596,忙しい日はインスタント食品を食べることがあります。,忙碌的日子有時會吃即食食品。
n3_0597,朝ご飯にオレンジを一つ食べました。,早餐吃了一顆柳橙。
n3_0598,ガムをかみながら話さないでください。,請不要一邊嚼口香糖一邊說話。
n3_0599,風邪を引いたのでお粥を食べました。,因為感冒，所以吃了粥。
n3_0600,ポテトにケチャップをかけました。,我在薯條上加了番茄醬。
n3_0601,父は夕食の時に少し酒を飲みます。,爸爸晚餐時會喝一點酒。
n3_0602,この店ではいろいろな種類の酒を売っています。,這家店販售各種酒類。
n3_0605,新鮮な野菜を市場で買いました。,我在市場買了新鮮的蔬菜。
n3_0606,寒い日は温かいスープが飲みたくなります。,天冷的日子會想喝熱湯。
n3_0607,パスタにトマトソースをかけました。,我在義大利麵上淋了番茄醬汁。
n3_0608,レストランでチップを置いて帰りました。,我在餐廳留下小費後離開。
n3_0609,食後に温かい茶を飲みました。,飯後喝了熱茶。
n3_0610,食事の後でデザートを注文しました。,用餐後點了甜點。
n3_0611,サラダにドレッシングを少しかけます。,我在沙拉上淋一點沙拉醬。
n3_0612,生の魚が苦手な人もいます。,也有人不敢吃生魚。
n3_0613,忙しい日はファストフードで昼食を済ませます。,忙碌的日子會用速食解決午餐。
n3_0614,パンにマヨネーズを塗りました。,我在麵包上塗了美乃滋。
n3_0615,寝る前に温かいミルクを飲みました。,睡前喝了溫牛奶。
n3_0616,誕生日に友達とワインで乾杯しました。,生日那天和朋友用葡萄酒乾杯。
n3_0617,コーヒーを机にこぼしてしまいました。,我不小心把咖啡灑在桌上了。
n3_0618,母は毎朝ご飯を炊きます。,媽媽每天早上煮飯。
n3_0619,もうすぐご飯が炊けます。,飯快要煮好了。
n3_0620,雨が強くなったので暖房を強めました。,雨變大了，所以我把暖氣調強。
n3_0621,この商品は低価格で人気があります。,這項商品價格低，所以很受歡迎。
n3_0622,野菜が柔らかく煮えました。,蔬菜煮得很軟了。
n3_0623,冷蔵庫で麦茶を冷やしています。,我正在冰箱裡冰麥茶。
n3_0624,魚を野菜と一緒に蒸します。,把魚和蔬菜一起蒸。
n3_0625,卵を七分ほど茹でてください。,請把蛋水煮大約七分鐘。
n3_0626,皿を落として割ってしまいました。,我把盤子掉到地上打破了。
n3_0627,シャツの襟が少し汚れています。,襯衫的衣領有點髒。
n3_0628,寒いのでオーバーコートを着て出かけました。,因為很冷，所以穿大衣出門。
n3_0629,週末はよくジーンズをはきます。,週末我常穿牛仔褲。
n3_0630,会議には黒いジャケットを着て行きました。,我穿黑色夾克去開會。
n3_0631,この学校の制服は紺色です。,這所學校的制服是深藍色。
n3_0632,セーターの袖が少し長いです。,這件毛衣的袖子有點長。
n3_0633,夏は白いティーシャツをよく着ます。,夏天我常穿白色 T 恤。
n3_0634,旅行には動きやすいパンツを持って行きます。,旅行時我會帶方便活動的褲子。
n3_0635,結婚式に黒いパンプスを履きました。,我穿黑色淑女鞋參加婚禮。
n3_0636,この靴は私の足にぴったりです。,這雙鞋很合我的腳。
n3_0637,母に白いブラウスを買いました。,我買了一件白色女用襯衫給媽媽。
n3_0638,古いかばんがぼろぼろになりました。,舊包包變得破破爛爛。
n3_0639,雨にぬれたので着替えを持って来ました。,因為淋雨了，所以帶了換洗衣物來。
n3_0640,首にスカーフを巻くと暖かいです。,把圍巾圍在脖子上會很暖。
n3_0641,寒い日は厚いストッキングをはきます。,天冷的日子會穿厚褲襪。
n3_0642,新しいスニーカーで散歩しました。,我穿新運動鞋去散步。
n3_0643,旅館で草履を借りました。,我在旅館借了日式草履。
n3_0644,運動の後でソックスを替えました。,運動後換了短襪。
n3_0645,財布をバッグに入れました。,我把錢包放進包包裡。
n3_0646,ベルトを締めてから外に出ました。,我繫好皮帶後出門。
n3_0647,工事現場ではヘルメットをかぶります。,在工地要戴安全帽。
n3_0648,寒い朝はマフラーをして出かけます。,寒冷的早晨會圍圍巾出門。
n3_0649,長く座っていたので尻が痛くなりました。,坐太久了，所以屁股痛了起來。
n3_0650,片足で立つとバランスが取りにくいです。,單腳站立時很難保持平衡。
n3_0651,日焼けで皮膚が赤くなりました。,皮膚因為曬傷而變紅了。
n3_0652,魚の骨がのどに刺さりました。,魚骨卡在喉嚨裡了。
n3_0653,日焼けした皮が剥けてきました。,曬傷的皮開始脫落了。
n3_0654,肩がこったので友達に揉んでもらいました。,肩膀僵硬，所以請朋友幫我按摩。
n3_0655,犬が花の匂いを嗅いでいます。,狗正在聞花的味道。
n3_0656,髪の毛を短く切りました。,我把頭髮剪短了。
n3_0657,冬は唇が乾きやすいです。,冬天嘴唇容易乾。
n3_0658,彼は怒ると急に黙ります。,他一生氣就會突然沉默。
n3_0659,熱を測るために額に手を当てました。,為了量體溫，我把手放在額頭上。
n3_0661,まつ毛が目に入って痛いです。,睫毛跑進眼睛裡很痛。
n3_0662,眠くてまぶたが重いです。,我很想睡，眼皮很沉。
n3_0663,駅で昔の先生を見掛けました。,我在車站偶然看見以前的老師。
n3_0664,走っている時に足首をひねりました。,跑步時扭到了腳踝。
n3_0665,親指でボタンを押してください。,請用拇指按按鈕。
n3_0666,新しい靴で歩いたら踵が痛くなりました。,穿新鞋走路後腳跟痛了起來。
n3_0667,爪を短く切ってください。,請把指甲剪短。
n3_0668,薬指に指輪をはめました。,我把戒指戴在無名指上。
n3_0669,小指を机の角にぶつけました。,小指撞到了桌角。
n3_0670,母は赤ちゃんを優しく抱きました。,媽媽溫柔地抱起寶寶。
n3_0671,ドアを軽く叩いてから入りました。,我輕敲門之後才進去。
n3_0672,犬をリードで繋いで散歩します。,我用牽繩繫著狗去散步。
n3_0673,つま先でそっと部屋に入りました。,我踮著腳尖悄悄進房間。
n3_0674,長くパソコンを使うと手首が痛くなります。,長時間用電腦會讓手腕痛。
n3_0675,手の甲に小さな傷があります。,手背上有一道小傷。
n3_0676,手の平に汗をかきました。,手掌流汗了。
n3_0677,中指で画面を押さえました。,我用中指按住螢幕。
n3_0678,人を殴ってはいけません。,不可以打人。
n3_0679,ベルを鳴らして店員を呼びました。,我按鈴叫店員。
n3_0680,彼はハンドルを強く握りました。,他用力握住方向盤。
n3_0681,雨で服を濡らしてしまいました。,我被雨淋濕了衣服。
n3_0682,腹が減ったので昼ご飯を食べました。,肚子餓了，所以吃了午餐。
n3_0683,引き出しの中の書類がばらばらです。,抽屜裡的文件很零散。
n3_0684,転んで膝をすりむきました。,跌倒後擦傷了膝蓋。
n3_0685,机に肘をつかないでください。,請不要把手肘撐在桌上。
n3_0686,人差し指で地図を指しました。,我用食指指著地圖。
n3_0687,紙を半分に曲げてください。,請把紙對折。
n3_0688,一生忘れられない思い出です。,這是一生都忘不了的回憶。
n3_0689,命を守るために早く避難してください。,為了保護生命，請盡快避難。
n3_0690,姉は去年男の子を産みました。,姊姊去年生了一個男孩。
n3_0691,申込書に生年月日を書いてください。,請在申請表上寫出生年月日。
n3_0692,新しいサービスの誕生をみんなで祝いました。,大家一起慶祝新服務的誕生。
n3_0693,老いを感じても運動は続けたいです。,即使感受到衰老，我還是想繼續運動。
n3_0694,高齢の方には席を譲りましょう。,請讓座給高齡者。
n3_0695,死後も彼の作品は多くの人に読まれています。,他死後，作品仍被許多人閱讀。
n3_0696,祖父は生前この町をとても愛していました。,祖父生前非常愛這座城鎮。
n3_0697,健康な体を保つために毎日歩いています。,為了保持健康的身體，我每天走路。
n3_0698,毎朝同じ時間に体重を測ります。,我每天早上在同一時間量體重。
n3_0699,子どもの身長が一年で大きく伸びました。,孩子的身高一年內長高很多。
n3_0700,寝る前に歯磨きを忘れないでください。,睡前不要忘記刷牙。
n3_0701,父は最近ひげを生やしています。,爸爸最近留了鬍子。
n3_0702,腕がかゆいので薬を塗りました。,手臂很癢，所以擦了藥。
n3_0703,昨夜は久しぶりにぐっすり眠れました。,昨晚久違地睡得很熟。
n3_0704,水を急いで飲んだらしゃっくりが出ました。,水喝太急後打嗝了。
n3_0705,体力をつけるために毎朝走っています。,為了增強體力，我每天早上跑步。
n3_0706,週末にしっかり休んで疲れを取りました。,週末好好休息，消除了疲勞。
n3_0707,発表の前は胸がどきどきします。,發表前心跳會很快。
n3_0708,シャツのボタンが一つ抜けています。,襯衫有一顆釦子掉了。
n3_0709,薬を飲んだら痛みが弱まりました。,吃藥後疼痛減弱了。
n3_0710,運動中に足を痛めました。,運動時弄傷了腳。
n3_0711,新しいウイルスについてニュースで知りました。,我從新聞得知新的病毒。
n3_0712,父は来週ひざの手術を受けます。,爸爸下週要接受膝蓋手術。
n3_0713,症状が続く時は病院へ行ってください。,症狀持續時請去醫院。
n3_0714,けが人の状態を医者に伝えました。,我把傷者的狀態告訴醫師。
n3_0715,熱が出て一日中ダウンしていました。,我發燒了，整天倒下休息。
n3_0716,早めに治療を始めることが大切です。,及早開始治療很重要。
n3_0718,足に包帯を巻いてもらいました。,我請人幫我在腳上纏繃帶。
n3_0719,この靴下は少し臭いです。,這雙襪子有點臭。
n3_0720,検査のために血液を取られました。,為了檢查，我被抽了血。
n3_0721,映画を見て涙が出ました。,看了電影後流下眼淚。
n3_0722,この飲み物には砂糖が多く含まれています。,這種飲料含有很多糖。
n3_0723,彼は顔に不満を現しました。,他把不滿表現在臉上。
n3_0724,少女が公園で本を読んでいます。,少女正在公園裡看書。
n3_0725,その少年は元気よく挨拶しました。,那個少年很有精神地打招呼。
n3_0726,日本では十八歳から成人です。,在日本，十八歲起就是成人。
n3_0727,この講座は中高年に人気があります。,這門課很受中高年歡迎。
n3_0728,中年になってから健康を意識するようになりました。,到了中年之後開始注意健康。
n3_0729,彼は私より三歳年上です。,他比我大三歲。
n3_0730,電車で年寄りに席を譲りました。,我在電車上讓座給老人。
n3_0732,目上の人には丁寧な言葉を使います。,對長輩或上司要使用有禮貌的說法。
n3_0733,老人がゆっくり道を渡っています。,老人正慢慢過馬路。
n3_0734,彼はアマチュアですが歌がとても上手です。,他雖然是業餘人士，但唱歌非常好。
n3_0735,妹さんはお元気ですか。,你妹妹還好嗎？
n3_0736,お孫さんはもう小学生ですか。,您的孫子或孫女已經是小學生了嗎？
n3_0737,学生たちは五人のグループで発表しました。,學生們以五人小組發表。
n3_0738,彼女は恋人と週末に旅行へ行きました。,她週末和情人去旅行。
n3_0739,高齢者向けのサービスが増えています。,面向高齡者的服務正在增加。
n3_0740,この町には有名な詩人が住んでいました。,這座城鎮曾住著一位有名的詩人。
n3_0741,職人が丁寧に器を作っています。,工匠正在細心製作器皿。
n3_0742,駅で知り合いに偶然会いました。,我在車站偶然遇到熟人。
n3_0743,彼は若者に人気のスターです。,他是受年輕人歡迎的明星。
n3_0744,応援団が大きな声で選手を励ましました。,加油團大聲鼓勵選手。
n3_0745,その団体は子どもを支援しています。,那個團體正在支援孩子。
n3_0746,彼は会社の長として責任を持っています。,他身為公司的首長負有責任。
n3_0747,兄はまだ独身です。,哥哥目前還是單身。
n3_0748,ベテランの先生に相談しました。,我向資深老師請教了。
n3_0749,週末にボランティアとして清掃に参加しました。,週末我以志工身分參加清掃。
n3_0750,家主にエアコンの故障を連絡しました。,我聯絡房東說冷氣故障了。
n3_0751,大学時代の友人と久しぶりに会いました。,我和大學時代的朋友久違地見面。
n3_0752,チームのリーダーが予定を説明しました。,團隊領導者說明了行程。
n3_0753,写真を見ると店のイメージが分かります。,看照片就能了解店的形象。
n3_0754,姉はいつもお洒落な服を着ています。,姊姊總是穿得很時髦。
n3_0755,彼の新しい髪型は格好いいです。,他的新髮型很帥。
n3_0756,出かける前に化粧をしました。,出門前化了妝。
n3_0757,弟は父に顔がそっくりです。,弟弟的臉和爸爸一模一樣。
n3_0758,彼女は派手な色の服が好きです。,她喜歡顏色花俏的衣服。
n3_0759,駅前で有名な美人に会いました。,我在車站前遇到有名的美女。
n3_0760,時間がなくて慌てて家を出ました。,因為沒時間了，所以慌張地出門。
n3_0761,意地悪なことを言わないでください。,請不要說刻薄的話。
n3_0762,子どもが壁に落書きの悪戯をしました。,孩子在牆上塗鴉惡作劇。
n3_0763,待ち時間が長くていらいらしました。,等待時間太長，讓我很煩躁。
n3_0764,この犬は大人しくて人を怖がりません。,這隻狗很溫順，不怕人。
n3_0765,書類をきちんと整理してください。,請把文件確實整理好。
n3_0766,彼はけちで人におごりません。,他很小氣，不請別人吃東西。
n3_0767,彼は新しいことに少し消極的です。,他對新事物有點消極。
n3_0768,馬鹿なことをして友達を怒らせました。,我做了蠢事，惹朋友生氣。
n3_0769,疲れていて勉強するやる気が出ません。,太累了，提不起讀書的幹勁。
n3_0770,公園で若いカップルが写真を撮っています。,年輕情侶正在公園拍照。
n3_0771,仕事ではコミュニケーションが大切です。,工作中溝通很重要。
n3_0772,彼とは学生時代から親しいです。,我和他從學生時代起就很親近。
n3_0773,駅前で友達とすれ違いました。,我在車站前和朋友錯身而過。
n3_0774,机を窓に近付けました。,我把桌子移近窗邊。
n3_0775,週末に恋人とデートします。,週末要和情人約會。
n3_0776,旅先で親切な人に出会いました。,我在旅途中遇見了親切的人。
n3_0777,信頼できるパートナーと仕事を進めます。,我會和可靠的夥伴推進工作。
n3_0778,問題について家族と話し合いました。,我和家人討論了這個問題。
n3_0779,友人の見送りに空港へ行きました。,我去機場送朋友。
n3_0780,一体何が起きたのか分かりません。,我完全不知道到底發生了什麼。
n3_0781,彼女は三人きょうだいの長女です。,她是三個手足中的長女。
n3_0782,あの夫婦は毎朝一緒に散歩しています。,那對夫妻每天早上一起散步。
n3_0783,結婚して名字が変わりました。,結婚後姓氏改變了。
n3_0784,姪に誕生日プレゼントを送りました。,我寄了生日禮物給姪女。
n3_0785,この靴は持ちがいいです。,這雙鞋很耐穿。
n3_0786,風が木の枝を大きく揺らしています。,風把樹枝大幅搖動著。
n3_0787,両親は私が小さい時に離婚しました。,父母在我小時候離婚了。
n3_0788,海には多くの生物が住んでいます。,海裡住著許多生物。
n3_0789,春になると桜が咲きます。,到了春天櫻花就會開。
n3_0790,庭に雑草がたくさん生えています。,院子裡長了很多雜草。
n3_0791,理科室で植物の標本を見ました。,我在理科教室看了植物標本。
n3_0792,朝食にヨーグルトとフルーツを食べました。,早餐吃了優格和水果。
n3_0793,実験で化学反応を観察しました。,實驗中觀察了化學反應。
n3_0794,彼女はダイヤモンドの指輪をしています。,她戴著鑽石戒指。
n3_0795,この町ではごみのリサイクルが進んでいます。,這座城鎮的垃圾回收正在推進。
n3_0796,朝ご飯を食べるとエネルギーが出ます。,吃早餐會有精神。
n3_0797,台所から煙が出ています。,廚房冒出煙。
n3_0798,庭で落ち葉を燃やしました。,我在院子裡燒了落葉。
n3_0799,このセーターはウールでできています。,這件毛衣是羊毛製的。
n3_0800,電池が切れて時計が止まりました。,電池沒電了，時鐘停了。
n3_0801,このシャツはコットンでできています。,這件襯衫是棉製的。
n3_0802,シルクのスカーフは手触りがいいです。,絲綢圍巾摸起來很舒服。
n3_0803,この工場では鉄鋼を生産しています。,這間工廠生產鋼鐵。
n3_0804,濡れた服をビニール袋に入れました。,我把濕掉的衣服放進塑膠袋裡。
n3_0805,使い捨てのプラスチックを減らしたいです。,我想減少使用一次性塑膠。
n3_0806,この服はポリエステルなので乾きやすいです。,這件衣服是聚酯纖維，所以容易乾。
n3_0807,今年は異常気象の影響で雨が多いです。,今年因為異常氣象的影響，雨很多。
n3_0808,地球には物を引く引力があります。,地球有吸引物體的引力。
n3_0809,部屋の温度を二十度に設定しました。,我把房間溫度設定成二十度。
n3_0810,年の暮れに家族で集まりました。,年底時家人聚在一起。
n3_0811,雨の日は部屋の湿気が気になります。,下雨天會在意房間裡的濕氣。
n3_0812,今日は湿度が高くて蒸し暑いです。,今天濕度高，很悶熱。
n3_0813,地球の環境を守ることは大切です。,保護地球環境很重要。
n3_0814,梅雨の時期は洗濯物が乾きにくいです。,梅雨季時衣服不容易乾。
n3_0815,秋が進むにつれて夜の寒さが深まります。,隨著秋天推進，夜晚的寒意加深。
n3_0816,停電で部屋が真っ暗になりました。,停電後房間變得一片漆黑。
n3_0817,外に出ると太陽が眩しかったです。,一走到外面，太陽很刺眼。
n3_0818,今日は風がなくて蒸し暑いです。,今天沒有風，很悶熱。
n3_0819,大雪で道が埋まりました。,道路被大雪埋住了。
n3_0820,葉の上に小さな水滴が残っています。,葉子上還留著小水滴。
n3_0821,子どもが部屋におもちゃを散らしました。,孩子把玩具弄得到處都是。
n3_0822,桜の花びらが風で散っています。,櫻花花瓣正被風吹散。
n3_0823,庭に雪が十センチほど積もりました。,院子裡積了大約十公分的雪。
n3_0824,風がだんだん強まってきました。,風漸漸變強了。
n3_0825,小麦粉を水で溶いて生地を作ります。,把麵粉用水調開來做麵糊。
n3_0826,暑さでアイスクリームが溶けました。,冰淇淋因為天氣熱而融化了。
n3_0827,汗を流してから家に帰りました。,流了一身汗後回家了。
n3_0828,川の水が静かに流れています。,河水正靜靜地流動。
n3_0829,古い紙が破れてしまいました。,舊紙張破掉了。
n3_0830,壁に小さな穴が開いています。,牆上有一個小洞。
n3_0831,正月には故郷へ帰ります。,過年時會回故鄉。
n3_0832,休日は自然の中で過ごしたいです。,假日想在大自然中度過。
n3_0833,雨で地盤が弱くなっています。,地基因為下雨變得鬆弱。
n3_0834,船は静かな湾に入りました。,船進入了平靜的海灣。
n3_0835,地方によって食文化が違います。,不同地區的飲食文化不一樣。
n3_0836,財布をどこかに忘れてきました。,我把錢包忘在某個地方了。
n3_0837,祖父は畑で野菜を作っています。,祖父在田裡種蔬菜。
n3_0838,子どもたちは先生を囲んで話を聞いています。,孩子們圍著老師聽他說話。
n3_0839,世間ではそのニュースが話題になっています。,那則新聞在社會上成為話題。
n3_0840,この店は地下にあります。,這家店在地下。
n3_0841,この地区は夜も人通りが多いです。,這個地區晚上也有很多人經過。
n3_0842,駅を中心に町が発展しました。,城鎮以車站為中心發展起來。
n3_0843,彼は東洋の歴史を研究しています。,他研究東洋歷史。
n3_0844,古い建物が所々に残っています。,老建築還零星留在各處。
n3_0845,試験の範囲を先生に確認しました。,我向老師確認了考試範圍。
n3_0846,そのうわさはすぐに学校中に広まりました。,那個傳聞很快傳遍全校。
n3_0847,新しい習慣を広めるには時間がかかります。,推廣新的習慣需要時間。
n3_0848,世の中にはいろいろな考え方があります。,社會上有各式各樣的想法。
n3_0849,間違っている箇所に線を引いてください。,請在錯誤的地方畫線。
n3_0850,坂を下る時はスピードに注意してください。,下坡時請注意速度。
n3_0851,駅の正面で友達を待っています。,我在車站正面等朋友。
n3_0852,地図の印を見て場所を確認しました。,我看著地圖上的標記確認位置。
n3_0853,旅行の途上で昔の友人に会いました。,旅途中遇見了以前的朋友。
n3_0854,写真が少し斜めになっています。,照片有點歪斜。
n3_0855,警察は二手に分かれて犯人を探しました。,警察分成兩路尋找犯人。
n3_0856,銀行は郵便局の向かいにあります。,銀行在郵局對面。
n3_0857,この靴は山登り向きではありません。,這雙鞋不適合爬山。
n3_0858,目的地まであと十分です。,到目的地還有十分鐘。
n3_0859,道の両側に桜の木があります。,道路兩側都有櫻花樹。
n3_0860,図書館は駅前の大きな館の中にあります。,圖書館在車站前那棟大建築物裡。
n3_0861,引っ越しの手続きを区役所でしました。,我在區公所辦了搬家手續。
