id,example_ja,example_zh
n3_1441,元旦の朝に年賀状が届きました。,元旦早上收到了賀年卡。
n3_1442,一昨昨日から熱が続いています。,從大前天開始一直發燒。
n3_1443,四月初旬に桜が咲きました。,四月上旬櫻花開了。
n3_1444,新年のあいさつをしました。,我做了新年問候。
n3_1445,この建物は西暦一九八〇年に建てられました。,這棟建築是在西元一九八〇年建造的。
n3_1446,先々月に引っ越しました。,上上個月搬家了。
n3_1447,先々週の会議を欠席しました。,上上週的會議我缺席了。
n3_1448,月日がたつのは早いです。,歲月流逝得很快。
n3_1449,当日は受付で名前を言ってください。,當天請在櫃台報上姓名。
n3_1450,長い年月をかけて研究を続けました。,花了漫長歲月持續研究。
n3_1451,面接の日時を確認しました。,我確認了面試的日期與時間。
n3_1452,日夜努力して資格を取りました。,日日夜夜努力後取得了證照。
n3_1453,日中は気温がかなり上がります。,白天氣溫會升高不少。
n3_1454,旅行の日程をもう一度確認しました。,我再次確認了旅行行程。
n3_1455,年間の売り上げを計算しました。,我計算了全年的銷售額。
n3_1456,年月がたっても思い出は消えません。,即使歲月流逝，回憶也不會消失。
n3_1457,この店は年中休まず営業しています。,這家店全年無休營業。
n3_1458,新しい年度の計画を立てました。,制定了新年度的計畫。
n3_1459,早起きして散歩に行きました。,早起去散步了。
n3_1460,半月ほど海外に滞在しました。,在海外停留了大約半個月。
n3_1461,半日かけて部屋を掃除しました。,花了半天打掃房間。
n3_1462,京都へ日帰りで旅行しました。,當天來回去京都旅行。
n3_1463,書類に日付を書いてください。,請在文件上寫日期。
n3_1464,昼過ぎに荷物が届きました。,中午過後行李送到了。
n3_1465,昼前に銀行へ行きました。,中午前去了銀行。
n3_1466,平成の時代に生まれました。,出生於平成時代。
n3_1467,真冬でもこの部屋は暖かいです。,即使是隆冬，這個房間也很暖。
n3_1468,夜中に電話が鳴りました。,半夜電話響了。
n3_1469,来週以降にもう一度連絡します。,下週之後會再聯絡一次。
n3_1470,いつか海外で働いてみたいです。,總有一天想在海外工作看看。
n3_1471,この気持ちをいつまでも忘れません。,我永遠不會忘記這份心情。
n3_1472,卒業以来、彼には会っていません。,畢業以來就沒見過他。
n3_1473,近代の歴史を勉強しています。,正在學習近代歷史。
n3_1474,現社長は海外経験が豊富です。,現任社長有豐富的海外經驗。
n3_1475,原始の生活について調べました。,我查了原始生活的相關資料。
n3_1476,親の意見に逆らって一人で決めました。,違背父母的意見，自己決定了。
n3_1477,先程お電話した者です。,我是剛才打電話的人。
n3_1478,長い話し合いの末、計画を変更しました。,長時間討論之後，改變了計畫。
n3_1479,戦後の社会について発表しました。,發表了關於戰後社會的內容。
n3_1480,中世の城を見学しました。,參觀了中世紀的城堡。
n3_1481,当時の写真がまだ残っています。,當時的照片還留著。
n3_1482,後程こちらから連絡いたします。,稍後由我們這邊聯絡您。
n3_1483,来年度の予定を確認しました。,確認了下個年度的預定。
n3_1484,一時はどうなるか心配しました。,有一段時間很擔心事情會變成怎樣。
n3_1485,締め切りを一週間延長しました。,把截止期限延長了一週。
n3_1486,短期のアルバイトを探しています。,正在找短期打工。
n3_1487,定期的に歯医者へ行っています。,我定期去看牙醫。
n3_1488,昔はこの村の井戸を使っていました。,以前使用這個村子的水井。
n3_1489,母は買い物に外出しています。,媽媽外出買東西了。
n3_1490,古い家屋を修理しました。,修理了老舊房屋。
n3_1491,田舎での暮らしに慣れてきました。,漸漸習慣鄉下生活了。
n3_1492,今日は自宅で仕事をします。,今天在家工作。
n3_1493,新しい住居を探しています。,正在找新的住處。
n3_1494,屋根の修繕を業者に頼みました。,請業者修繕屋頂。
n3_1495,この辺りは住宅が多いです。,這一帶住宅很多。
n3_1496,駅の近くに新しい住宅地ができました。,車站附近形成了新的住宅區。
n3_1497,試合は午後三時にスタートします。,比賽下午三點開始。
n3_1498,古いビルを取り壊すことになりました。,決定拆除老舊大樓。
n3_1499,軒の下で雨宿りしました。,在屋簷下躲雨。
n3_1500,台風に備えて雨戸を閉めました。,為了防颱，把防雨拉門關上了。
n3_1501,城の周りに石垣が残っています。,城的周圍還留有石牆。
n3_1502,庭の垣根をきれいに整えました。,把庭院的圍籬整理好了。
n3_1503,古い瓦を新しいものに替えました。,把舊屋瓦換成新的。
n3_1504,ドアの隙間から光が入っています。,光從門縫透進來。
n3_1505,夕方、庭で涼みました。,傍晚在庭院乘涼。
n3_1506,家の周りに高い塀があります。,房子周圍有高高的圍牆。
n3_1507,使わない道具を物置に入れました。,把不用的工具放進儲藏室。
n3_1508,煉瓦の壁がとてもおしゃれです。,磚牆很有風格。
n3_1509,石けんの泡が手につきました。,肥皂泡沫沾在手上。
n3_1510,板を二枚買って棚を作りました。,買了兩片木板做架子。
n3_1511,このホテルは部屋が広くて快適です。,這間飯店房間寬敞又舒適。
n3_1512,窓を開けて換気してください。,請打開窗戶換氣。
n3_1513,客間にお客様を案内しました。,把客人帶到客房。
n3_1514,座敷で親戚が集まりました。,親戚們聚在和室裡。
n3_1515,床に布団を敷きました。,在地板上鋪了棉被。
n3_1516,障子を開けると庭が見えます。,打開紙拉門就看得到庭院。
n3_1517,家族が食卓を囲みました。,家人圍坐在餐桌旁。
n3_1518,父は書斎で本を読んでいます。,爸爸在書房看書。
n3_1519,朝起きたらすぐ洗面します。,早上起床後馬上洗臉。
n3_1520,子どもがおもちゃを散らかしました。,孩子把玩具弄得到處都是。
n3_1521,机の上が書類で散らかっています。,桌上被文件弄得很亂。
n3_1522,手洗いは廊下の奥にあります。,廁所在走廊深處。
n3_1523,床の間に花が飾ってあります。,和室壁龕裡裝飾著花。
n3_1524,犬が小屋の中に引っ込みました。,狗縮回小屋裡了。
n3_1525,橋の袂で友人を待ちました。,在橋邊等朋友。
n3_1526,古い駅の便所を新しくしました。,把舊車站的廁所翻新了。
n3_1527,参加者は銘々好きな席に座りました。,參加者各自坐在喜歡的座位。
n3_1528,夜中に物音がして目が覚めました。,半夜有聲響，把我吵醒了。
n3_1529,封筒を破いて中の手紙を出しました。,撕開信封拿出裡面的信。
n3_1530,薄暗い部屋で本を読みました。,在昏暗的房間裡看書。
n3_1531,駅の近くで貸間を探しています。,正在車站附近找出租套房。
n3_1532,この辺りには貸家が多いです。,這一帶出租住宅很多。
n3_1533,新しい住まいに引っ越しました。,搬到了新的住處。
n3_1534,駅前の団地に友人が住んでいます。,朋友住在車站前的集合住宅區。
n3_1535,彼は好奇心が旺盛です。,他好奇心旺盛。
n3_1536,ご飯のお代わりをお願いします。,請再給我添一碗飯。
n3_1537,料理に使う器具を洗いました。,把料理用具洗好了。
n3_1538,このケーキはカロリーが高いです。,這個蛋糕熱量很高。
n3_1539,虫に足を食われました。,腳被蟲咬了。
n3_1540,高級なレストランで食事しました。,在高級餐廳用餐了。
n3_1541,一週間の献立を考えました。,想了一週的菜單。
n3_1542,新鮮な刺身を食べました。,吃了新鮮的生魚片。
n3_1543,運動した後は気分がさっぱりします。,運動後心情很清爽。
n3_1544,このスープは少し塩辛いです。,這碗湯有點鹹。
n3_1545,このソースはしつこくなくて食べやすいです。,這個醬汁不濃膩，很好入口。
n3_1546,上品な味の和菓子です。,這是味道高雅的和菓子。
n3_1547,健康のために食生活を見直しました。,為了健康重新檢視飲食生活。
n3_1548,暑さで食欲がありません。,因為天氣熱沒有食慾。
n3_1549,粗末な食事でも感謝して食べました。,即使是簡陋的餐點也心懷感謝地吃了。
n3_1550,昼食は会社の近くで食べます。,午餐在公司附近吃。
n3_1551,朝食にパンと卵を食べました。,早餐吃了麵包和蛋。
n3_1552,コップに水を注ぎました。,把水倒進杯子裡。
n3_1553,皿の料理を残らず食べました。,把盤子裡的料理全部吃完了。
n3_1554,金曜日に職場の飲み会があります。,星期五有職場酒會。
n3_1555,ホテルの朝食はバイキングです。,飯店早餐是自助餐。
n3_1556,会費で会場費を賄いました。,用會費支付了場地費。
n3_1557,欲張って料理を取りすぎました。,太貪心拿了太多料理。
n3_1558,父はウィスキーを少しだけ飲みます。,爸爸只喝一點威士忌。
n3_1559,今日のおかずは焼き魚です。,今天的配菜是烤魚。
n3_1560,ケーキにクリームをのせました。,在蛋糕上放了鮮奶油。
n3_1561,昼食は各自持参してください。,午餐請各自自備。
n3_1562,食塩を少し加えて味を調えます。,加一點食鹽調味。
n3_1563,冷蔵庫に食物を保存します。,把食物保存在冰箱裡。
n3_1564,豆腐を味噌汁に入れました。,把豆腐放進味噌湯。
n3_1565,温かい飯を茶わんに盛りました。,把熱飯盛進碗裡。
n3_1566,皿にサラダを盛りました。,把沙拉盛到盤子裡。
n3_1567,忙しい日は冷凍食品を使います。,忙碌的日子會使用冷凍食品。
n3_1568,濃いジュースを水で薄めました。,把濃果汁用水稀釋了。
n3_1569,食べる前に十分に加熱してください。,吃之前請充分加熱。
n3_1570,パンを焦がしてしまいました。,不小心把麵包烤焦了。
n3_1571,キャンプではみんなで炊事をしました。,露營時大家一起煮飯。
n3_1572,コップにお茶を注ぎました。,把茶倒進杯子裡。
n3_1573,料理に合う調味料を選びました。,選了適合料理的調味料。
n3_1574,料理の出来上がりを写真に撮りました。,把完成的料理拍了照。
n3_1575,ケーキがきれいに出来上がりました。,蛋糕漂亮地完成了。
n3_1576,鍋を強火で熱します。,用大火加熱鍋子。
n3_1577,肉にはしっかり火を通してください。,肉請確實煮熟。
n3_1578,鍋から白い湯気が上がっています。,鍋子冒出白色蒸氣。
n3_1579,魚を冷凍して保存しました。,把魚冷凍保存了。
n3_1580,支払い済みの印を付けました。,蓋上了已付款的章。
n3_1581,壁に細かいひびが入っています。,牆上有細小裂痕。
n3_1582,衣料品売り場は三階です。,衣料品賣場在三樓。
n3_1583,週末は家族でお出掛けします。,週末會和家人出門。
n3_1584,花の香りが部屋に広がりました。,花香在房間裡散開。
n3_1585,布の切れで小さな袋を作りました。,用碎布做了小袋子。
n3_1586,毛皮のコートは暖かいです。,毛皮大衣很暖和。
n3_1587,シャツにコーヒーの染みが残りました。,襯衫上留下了咖啡污漬。
n3_1588,洗濯物をベランダに吊るしました。,把洗好的衣服吊在陽台。
n3_1589,結婚式に着るドレスを選びました。,選了婚禮要穿的禮服。
n3_1590,寝る前に寝間着に着替えました。,睡前換上睡衣。
n3_1591,汗をかいたので肌着を替えました。,因為流汗，所以換了內衣。
n3_1592,華やかな着物を着ています。,她穿著華麗的和服。
n3_1593,面接に合う服装を選びました。,選了適合面試的服裝。
n3_1594,風船が大きく膨らみました。,氣球膨脹得很大。
n3_1595,海へ行くために水着を買いました。,為了去海邊買了泳裝。
n3_1596,この建物はモダンなデザインです。,這棟建築是現代風設計。
n3_1597,夏祭りに浴衣を着て行きました。,穿浴衣去了夏日祭典。
n3_1598,ゆったりした服が好きです。,我喜歡寬鬆舒適的衣服。
n3_1599,祖母は和服をきれいに着ます。,祖母把和服穿得很漂亮。
n3_1600,白いワンピースを買いました。,買了一件白色洋裝。
n3_1601,料理をする時はエプロンを着けます。,做菜時會穿圍裙。
n3_1602,着物の帯をきれいに結びました。,把和服腰帶綁得很漂亮。
n3_1603,料理にふたを被せて少し待ちます。,把蓋子蓋在料理上後稍等一下。
n3_1604,祭りで下駄を履きました。,在祭典上穿了木屐。
n3_1605,説明を聞くだけでなく直に見てください。,不要只聽說明，請直接看。
n3_1606,着物には足袋を合わせます。,和服會搭配日式分趾襪。
n3_1607,枝が道の上に垂れ下がっています。,樹枝垂在路上方。
n3_1608,今日は寒いので長袖を着ました。,今天很冷，所以穿了長袖。
n3_1609,弟は学校でバンドを組んでいます。,弟弟在學校組了樂團。
n3_1610,母は上着に小さなブローチを付けました。,媽媽在外套上別了小胸針。
n3_1611,古い服の袖がほころびています。,舊衣服的袖子開線了。
n3_1612,靴ひもをほどいてから脱ぎました。,解開鞋帶後脫了鞋。
n3_1613,毛糸でマフラーを編みました。,用毛線織了圍巾。
n3_1614,汗を手拭いで拭きました。,用手巾擦了汗。
n3_1615,このセーターは羊毛でできています。,這件毛衣是羊毛做的。
n3_1616,枕の中に綿が入っています。,枕頭裡裝著棉花。
n3_1617,父は重い荷物を肩に担ぎました。,爸爸把重行李扛在肩上。
n3_1618,運動すると足の筋肉が痛くなります。,運動後腿部肌肉會痛。
n3_1619,疲れたのでベンチに腰掛けました。,因為累了，就坐在長椅上。
n3_1620,雨の日に駅の階段で転びました。,下雨天在車站樓梯跌倒了。
n3_1621,姿勢を正して座ってください。,請坐正姿勢。
n3_1622,子どもがしゃがんで石を拾いました。,孩子蹲下來撿石頭。
n3_1623,休暇を取って心身を休めました。,請假讓身心休息。
n3_1624,庭の木を手入れしました。,整理修剪了庭院的樹。
n3_1625,ロボットの動作を確認しました。,確認了機器人的動作。
n3_1626,犬がうれしそうに飛び跳ねています。,狗開心地蹦蹦跳跳。
n3_1627,この包丁は刃が鈍いです。,這把菜刀刀刃不利。
n3_1628,赤ちゃんは裸で体重を量りました。,嬰兒赤裸著量體重。
n3_1629,夜空を見上げると星が見えました。,仰望夜空就看見了星星。
n3_1630,壁にもたれて少し休みました。,靠著牆稍微休息。
n3_1631,かばんを脇に置きました。,把包包放在旁邊。
n3_1632,祖母は毎冬セーターを編みます。,祖母每年冬天都會織毛衣。
n3_1633,外から帰ったらうがいをしてください。,從外面回來後請漱口。
n3_1634,彼は面長で落ち着いた印象です。,他是長臉，給人沉穩的印象。
n3_1635,台所が煙くて窓を開けました。,廚房煙很嗆，所以打開了窗戶。
n3_1636,走った後は呼吸が乱れます。,跑步後呼吸會亂。
n3_1637,父は白髪が増えました。,爸爸白髮變多了。
n3_1638,川の水が透き通っています。,河水很清澈。
n3_1639,彼女は鋭い質問をしました。,她提出了敏銳的問題。
n3_1640,父は毎朝ひげを剃ります。,爸爸每天早上刮鬍子。
n3_1641,彼は深いため息をつきました。,他深深嘆了一口氣。
n3_1642,洗濯物から水が垂れています。,洗好的衣服正在滴水。
n3_1643,湿気で髪が縮れました。,頭髮因為濕氣而捲曲。
n3_1644,ポケットに手を突っ込みました。,把手插進口袋。
n3_1645,この髪は艶があります。,這頭髮很有光澤。
n3_1646,ドアのすき間から中を覗きました。,從門縫往裡看。
n3_1647,紙がドアに挟まりました。,紙被門夾住了。
n3_1648,準備はばっちりです。,準備非常充分。
n3_1649,彼女の瞳はとてもきれいです。,她的眼睛很漂亮。
n3_1650,赤ちゃんが母親に微笑みました。,嬰兒對媽媽微笑了。
n3_1651,寝不足で頭がぼんやりしています。,睡眠不足讓頭腦昏沉。
n3_1652,展望台から町を見下ろしました。,從展望台俯視城市。
n3_1653,彼は写真をじっと見詰めていました。,他一直凝視著照片。
n3_1654,暑いのでうちわで扇ぎました。,因為很熱，就用扇子搧風。
n3_1655,雪の上に足跡が残っています。,雪上留下了腳印。
n3_1656,足元に気を付けてください。,請注意腳下。
n3_1657,遠いところまで足を運んでくれてありがとう。,謝謝你特地遠道而來。
n3_1658,彼は手先が器用です。,他手很巧。
n3_1659,井戸から水を汲みました。,從井裡打了水。
n3_1660,湖でボートを漕ぎました。,在湖上划了船。
n3_1661,汚れた部分を布で擦りました。,用布搓了髒掉的地方。
n3_1662,長く座っていたので足が痺れました。,坐太久所以腳麻了。
n3_1663,ぬれたタオルを強く絞りました。,用力擰乾濕毛巾。
n3_1664,薬を飲んだら痛みがすっと引きました。,吃了藥後疼痛一下子退了。
n3_1665,店の前で立ち止まりました。,在店門口停下腳步。
n3_1666,パンを小さくちぎって食べました。,把麵包撕成小塊吃。
n3_1667,車がのろのろ進んでいます。,車子慢吞吞地前進。
n3_1668,古いポスターを壁から剥がしました。,把舊海報從牆上撕下來。
n3_1669,排水口がごみで塞がっています。,排水孔被垃圾堵住了。
n3_1670,指の節が少し痛いです。,手指關節有點痛。
n3_1671,かばんを肩にぶら下げました。,把包包掛在肩上。
n3_1672,展示品には触れないでください。,請不要碰觸展示品。
n3_1673,重い箱を二人で持ち上げました。,兩個人一起抬起重箱子。
n3_1674,この病気は遺伝することがあります。,這種病有時會遺傳。
n3_1675,遺伝子の研究が進んでいます。,基因研究正在進展。
n3_1676,救助隊は人命を守るために働きました。,救難隊為了保護人命而行動。
n3_1677,水は生命に欠かせません。,水是生命不可或缺的。
n3_1678,自殺を防ぐための相談窓口があります。,有防止自殺的諮詢管道。
n3_1679,事故の死者は三人でした。,事故死者有三人。
n3_1680,警察は死体の身元を確認しました。,警方確認了遺體身分。
n3_1681,この電池の寿命は長いです。,這個電池的使用期限很長。
n3_1682,シャツのしわをアイロンで伸ばしました。,用熨斗把襯衫皺摺燙平。
n3_1683,厳しい環境で生存する力が必要です。,需要在嚴苛環境中生存的能力。
n3_1684,ここで写真を撮ってはいけません。,這裡不可以拍照。
n3_1685,こんなに暑い日は久しぶりです。,這麼熱的日子很久沒遇到了。
n3_1686,茶道の作法を学びました。,學了茶道的禮法。
n3_1687,血圧を測定しました。,測量了血壓。
n3_1688,洗濯したらセーターが縮みました。,洗了之後毛衣縮水了。
n3_1689,子どもの発育には睡眠が大切です。,睡眠對孩子的發育很重要。
n3_1690,昼寝をしたので少し元気になりました。,睡了午覺後精神好了一點。
n3_1691,祖父は今も若々しいです。,祖父現在仍然很有年輕活力。
n3_1692,強い風で海が荒れています。,因為強風，海面很洶湧。
n3_1693,風邪で体調を崩しました。,因為感冒身體狀況變差了。
n3_1694,長い運動で体力を消耗しました。,長時間運動消耗了體力。
n3_1695,身体を大切にしてください。,請保重身體。
n3_1696,体温を毎朝測っています。,每天早上都量體溫。
n3_1697,シャツのボタンが取れました。,襯衫的鈕扣掉了。
n3_1698,時間を計って作業しました。,計時進行了作業。
n3_1699,資料を全員に回してください。,請把資料傳給所有人。
n3_1700,急に立ち上がって目眩がしました。,突然站起來後頭暈了。
n3_1701,昔の記憶がよみがえりました。,以前的記憶重新浮現。
n3_1702,腰の痛みが続いています。,腰痛持續著。
n3_1703,傷口がまだ痛みます。,傷口還會痛。
n3_1704,患者は痛みで低く唸りました。,患者因疼痛低聲呻吟。
n3_1705,肩が凝ってつらいです。,肩膀僵硬痠痛，很難受。
n3_1706,頭痛がひどいので薬を飲みました。,頭痛很嚴重，所以吃了藥。
n3_1707,虫歯を治療してもらいました。,請醫師治療了蛀牙。
n3_1708,たばこは健康に害があります。,菸對健康有害。
n3_1709,風邪薬を飲んで早く寝ました。,吃了感冒藥後早點睡。
n3_1710,彼は病気がちで学校を休みやすいです。,他容易生病，常請假不上學。
n3_1711,母の看病で病院に通いました。,為了照護媽媽，我常去醫院。
n3_1712,長い痛みが彼を苦しめました。,長期疼痛折磨著他。
n3_1713,この薬はとても効果的です。,這個藥很有效。
n3_1714,薬の効力が弱くなりました。,藥的效力變弱了。
n3_1715,苦手な発音を克服しました。,克服了不擅長的發音。
n3_1716,転んで腕を骨折しました。,跌倒後手臂骨折了。
n3_1717,差し支えなければ理由を教えてください。,如果不方便也沒關係，但可以告訴我理由嗎？
n3_1718,事故で重傷を負いました。,在事故中受了重傷。
n3_1719,傷口を消毒してください。,請消毒傷口。
n3_1720,生活習慣病を防ぐために運動しています。,為了預防生活習慣病而運動。
n3_1721,病気と闘う患者を支えたいです。,想支持與疾病對抗的患者。
n3_1722,気温が急に低下しました。,氣溫突然下降。
n3_1723,適切な言葉を選んでください。,請選擇適切的詞語。
n3_1724,この病気は人から人へ伝染します。,這種病會人傳人。
n3_1725,手術中に輸血が必要になりました。,手術中需要輸血。
n3_1726,走った後で汗をかきました。,跑步後流了汗。
n3_1727,週末は家で休養します。,週末在家休養。
n3_1728,血液の循環をよくする運動です。,這是促進血液循環的運動。
n3_1729,食べ物の消化を助ける薬です。,這是幫助食物消化的藥。
n3_1730,医師に小便の検査を受けるよう言われました。,醫師叫我接受尿液檢查。
n3_1731,彼は細かいことに神経を使いすぎます。,他太在意細節了。
n3_1732,園児たちは庭で遊んでいます。,幼兒園幼童們在庭院玩。
n3_1733,あの女の人に道を聞きました。,我向那位女性問路。
n3_1734,これは架空の人物の話です。,這是虛構人物的故事。
n3_1735,資料は各自で用意してください。,資料請各自準備。
n3_1736,夕日の影が長く伸びています。,夕陽的影子拉得很長。
n3_1737,彼女は知識と経験を兼ね備えています。,她兼具知識與經驗。
n3_1738,部屋に人の気配がありません。,房間裡沒有人的氣息。
n3_1739,今日は実に楽しい一日でした。,今天實在是很開心的一天。
n3_1740,歴史上の人物について調べました。,查了歷史人物。
n3_1741,短所を直す努力をしています。,正在努力改正短處。
n3_1742,人目を気にして大きな声を出せませんでした。,在意旁人眼光，所以不敢大聲說話。
n3_1743,身分を証明する書類が必要です。,需要證明身分的文件。
n3_1744,市は節水を市民に呼び掛けました。,市政府號召市民節約用水。
n3_1745,彼女はビジネスウーマンとして働いています。,她以職業女性的身分工作。
n3_1746,駅の前に男の人が立っています。,車站前站著一位男性。
n3_1747,青少年向けのイベントを開きました。,舉辦了面向青少年的活動。
n3_1748,申込書に性別を書く欄があります。,申請表上有填寫性別的欄位。
n3_1749,男子トイレは右側です。,男廁在右側。
n3_1750,彼は私より三歳年下です。,他比我小三歲。
n3_1751,坊や、ここで走ると危ないよ。,小弟弟，在這裡跑很危險喔。
