id,pos,verb_class,transitivity,example_ja,example_zh,note
n3_0493,noun,,,旅行の予算を先に決めました。,我先決定了旅行預算。,
n3_0494,suru_noun,,,明日の天気を予測するのは難しいです。,要預測明天的天氣很難。,
n3_0495,suru_noun,,,風邪を予防するために手を洗います。,為了預防感冒而洗手。,
n3_0496,noun,,,今日は少し時間に余裕があります。,今天時間上有一點餘裕。,
n3_0497,na_adjective,,,乱暴な運転は危険です。,粗暴的駕駛方式很危險。,
n3_0498,noun,,,会社の利益は去年より増えました。,公司的利益比去年增加了。,
n3_0499,verb,suru,,説明を聞いて内容を理解しました。,聽完說明後理解了內容。,
n3_0500,noun,,,理屈は分かりますが、納得はできません。,道理我懂，但無法接受。,
n3_0501,noun,,,理想の働き方について話し合いました。,我們討論了理想的工作方式。,
n3_0502,suru_noun,,,今年は短い動画が流行しています。,今年短影片很流行。,
n3_0503,noun,,,ご飯の量を少し減らしました。,我稍微減少了飯量。,
n3_0504,noun,,,領収書を必ず受け取ってください。,請一定要收下收據。,
n3_0505,noun,,,規則には例外もあります。,規則也有例外。,
n3_0506,na_adjective,,,冷静に状況を判断してください。,請冷靜判斷狀況。,
n3_0507,noun,,,入り口の前に長い列ができています。,入口前排了長長的隊伍。,
n3_0508,noun,,,卒業論文のテーマを決めました。,我決定了畢業論文的題目。,
n3_0509,noun,,,職人の技を近くで見ました。,我近距離看了職人的技術。,
n3_0510,na_adjective,,,残り時間は僅かです。,剩下的時間很少。,
n3_0511,noun,,,そのニュースは学校中の話題になりました。,那則新聞成了全校的話題。,
n3_0512,adverb,,,電車はあっという間に駅に着きました。,電車轉眼間就到站了。,
n3_0513,noun,,,電車の遅れで会議に間に合いませんでした。,因為電車延誤，沒趕上會議。,
n3_0514,adverb,,,ぎりぎりで締め切りに間に合いました。,我剛好趕上了截止期限。,
n3_0515,noun,,,映画の後半で話が大きく変わります。,電影後半段劇情有很大的變化。,
n3_0516,noun,,,正午に駅前で会いましょう。,中午十二點在車站前見吧。,
n3_0517,noun,,,深夜まで仕事をしていました。,我工作到深夜。,
n3_0518,noun,,,二十世紀の音楽に興味があります。,我對二十世紀的音樂有興趣。,
n3_0519,noun,,,試験の前半は簡単でした。,考試前半部很簡單。,
n3_0520,noun,,,早朝に散歩すると気持ちがいいです。,清晨散步很舒服。,
n3_0521,suru_noun,,,寝坊して学校に遅刻しました。,我睡過頭所以上學遲到了。,
n3_0522,adverb,,,二つの作業を同時に進めています。,兩項作業正在同時進行。,
n3_0523,adverb,,,突然雨が降り出しました。,雨突然下了起來。,
n3_0524,noun,,,新しい生活の始まりにわくわくしています。,我對新生活的開始感到興奮。,
n3_0525,verb,ichidan,,夜が更けても町はにぎやかでした。,夜深了，城鎮仍然熱鬧。,
n3_0526,suffix,,,十年ぶりに高校の友達に会いました。,我睽違十年見到高中朋友。,
n3_0527,verb,ichidan,,長い年月を経て建物は古くなりました。,經過漫長歲月後，建築物變舊了。,
n3_0528,adverb,,,必要な資料を前もって準備しました。,我事先準備好了需要的資料。,
n3_0529,noun,,,真夜中に電話が鳴りました。,半夜電話響了。,
n3_0530,noun,,,夜間は入り口を閉めています。,夜間入口會關閉。,
n3_0531,noun,,,一昨年、初めて北海道へ行きました。,前年我第一次去了北海道。,
n3_0532,noun,,,結果は今月下旬に発表されます。,結果會在本月下旬公布。,
n3_0533,noun,,,月末までに家賃を払ってください。,請在月底前繳房租。,
n3_0534,noun,,,昨年は海外旅行に行けませんでした。,去年沒能去海外旅行。,
n3_0535,noun,,,その日は一日中雨でした。,那一天整天都在下雨。,
n3_0536,noun,,,来週から新しい授業が始まります。,下週開始新的課程。,
n3_0537,noun,,,七月上旬に旅行する予定です。,預計七月上旬去旅行。,
n3_0538,noun,,,先日、駅で先生に会いました。,前些日子在車站遇到老師。,
n3_0539,noun,,,試験の前日は早く寝ました。,考試前一天我很早睡。,
n3_0540,noun,,,会議は来月中旬に行われます。,會議會在下個月中旬舉行。,
n3_0541,noun,,,年始は多くの店が休みです。,年初許多店家休息。,
n3_0542,noun,,,年末年始は家族と過ごします。,年底年初會和家人一起度過。,
n3_0543,noun,,,平日は朝七時に起きます。,平日早上七點起床。,
n3_0544,noun,,,本日はご来店ありがとうございます。,今天感謝您光臨。,
n3_0545,noun,,,本年もよろしくお願いいたします。,今年也請多多指教。,
n3_0547,noun,,,曜日を間違えて学校へ行ってしまいました。,我搞錯星期幾，結果去了學校。,
n3_0548,prefix,,,翌朝、雪はすっかり止んでいました。,隔天早上雪已經完全停了。,
n3_0549,noun,,,翌日、彼から返事が来ました。,隔天他回覆了。,
n3_0550,noun,,,午後三時以後に来てください。,請下午三點以後再來。,
n3_0551,noun,,,以前ここには小さな本屋がありました。,以前這裡有一家小書店。,
n3_0552,noun,,,現代の生活にはインターネットが欠かせません。,現代生活少不了網路。,
n3_0553,noun,,,今後の予定をメールで知らせます。,我會用電子郵件告知今後的行程。,
n3_0554,noun,,,事故の事後処理に時間がかかりました。,事故發生後的處理花了不少時間。,
n3_0555,noun,,,発表の直後に質問が出ました。,發表剛結束後就有人提問。,
n3_0556,noun,,,出発直前に雨が降り始めました。,出發前一刻開始下雨。,
n3_0557,noun,,,未来の自分に手紙を書きました。,我寫了一封信給未來的自己。,
n3_0558,noun,,,桜のシーズンには観光客が増えます。,櫻花季時觀光客會增加。,
n3_0559,noun,,,申し込みの締め切りは明日です。,報名截止期限是明天。,
n3_0560,verb,ichidan,,足りない資料は古いもので間に合わせました。,不足的資料先用舊的臨時湊合。,
n3_0561,suru_noun,,,授業が終わったらすぐ帰宅します。,下課後會立刻回家。,
n3_0562,verb,godan,,祖母は田舎で一人で暮らしています。,祖母在鄉下一個人生活。,
n3_0564,verb,godan,,週末は家族とゆっくり過ごしました。,週末和家人悠閒地度過了。,
n3_0565,na_adjective,,,台所はいつも清潔にしています。,廚房一直保持清潔。,
n3_0566,suru_noun,,,弟は家で留守番をしています。,弟弟在家看家。,
n3_0567,determiner,,,我が家では朝ご飯を一緒に食べます。,我們家會一起吃早餐。,
n3_0568,verb,ichidan,,寒いので窓を閉じてください。,因為很冷，請把窗戶關上。,
n3_0569,suru_noun,,,入る前にドアをノックしてください。,進來前請先敲門。,
n3_0570,noun,,,ベランダで洗濯物を干しました。,我在陽台曬衣服。,
n3_0571,noun,,,屋根の上に雪が積もっています。,屋頂上積著雪。,
n3_0572,verb,godan,,彼は約束を破りました。,他違反了約定。,
n3_0573,suru_noun,,,出かける前にドアをロックしてください。,出門前請把門鎖上。,
n3_0574,noun,,,冬は暖房をつけて部屋を暖めます。,冬天會開暖氣讓房間變暖。,
n3_0575,noun,,,クリスマスの飾りを窓に付けました。,我把聖誕裝飾掛在窗邊。,
n3_0576,noun,,,キッチンで夕食を作っています。,正在廚房做晚餐。,
n3_0577,noun,,,寝室の電気を消して寝ました。,關掉寢室的燈後睡覺了。,
n3_0578,noun,,,洗面所で顔を洗いました。,我在洗手台洗了臉。,
n3_0579,noun,,,家族はダイニングで朝食を食べます。,家人在餐廳吃早餐。,
n3_0580,verb,godan,,排水口が詰まって水が流れません。,排水口塞住，水流不下去。,
n3_0581,noun,,,天井に新しい照明を付けました。,我在天花板裝了新的照明。,
n3_0582,noun,,,古い家の柱はとても太いです。,老房子的柱子很粗。,
n3_0583,noun,,,日差しが強いのでブラインドを下ろしました。,陽光太強，所以放下百葉窗。,
n3_0584,noun,,,引っ越す前に部屋の間取りを確認しました。,搬家前確認了房間格局。,
n3_0585,noun,,,寒い夜は毛布を一枚多く使います。,寒冷的夜晚會多用一條毛毯。,
n3_0586,noun,,,床に荷物を置かないでください。,請不要把行李放在地板上。,
n3_0587,verb,ichidan,,音が大きすぎるので少し弱めました。,聲音太大，所以我稍微調小了。,
n3_0588,noun,,,家族はリビングでテレビを見ています。,家人正在客廳看電視。,
n3_0589,noun,,,肉の脂を少し取ってから焼きます。,先去掉一點肉的油脂再烤。,
n3_0590,noun,,,この薬は食後に飲んでください。,這個藥請飯後服用。,
n3_0591,noun,,,食前に手を洗いましょう。,飯前洗手吧。,
n3_0592,i_adjective,,,このみかんは少し酸っぱいです。,這顆橘子有點酸。,
n3_0593,noun,,,食事のマナーを守りましょう。,遵守用餐禮儀吧。,
n3_0594,noun,,,レストランでメニューを見ています。,正在餐廳看菜單。,
n3_0595,noun,,,今日は友達とランチに行きます。,今天要和朋友去吃午餐。,
n3_0596,noun,,,忙しい日はインスタント食品を食べることがあります。,忙碌的日子有時會吃即食食品。,
n3_0597,noun,,,朝ご飯にオレンジを一つ食べました。,早餐吃了一顆柳橙。,
n3_0598,noun,,,ガムをかみながら話さないでください。,請不要一邊嚼口香糖一邊說話。,
n3_0599,noun,,,風邪を引いたのでお粥を食べました。,因為感冒，所以吃了粥。,
n3_0600,noun,,,ポテトにケチャップをかけました。,我在薯條上加了番茄醬。,
